figure,path,source,caption_seed,main_text
figure1_design_comparison,artifacts/scis2026/main_figures_v1/figure1_design_comparison.png,design specification,Prior diagonal persona-temperature bundles are contrasted with the SCIS fully crossed persona x temperature design.,False
figure1a_prior_diagonal_design,artifacts/scis2026/main_figures_v1/figure1a_prior_diagonal_design.png,design specification,"Prior work bundled each persona with one temperature, producing diagonal-only coverage.",True
figure1b_factorial_design,artifacts/scis2026/main_figures_v1/figure1b_factorial_design.png,design specification,SCIS independently crosses persona and temperature to estimate main effects and interaction.,True
figure2_representative_heatmaps,artifacts/scis2026/main_figures_v1/figure2_representative_heatmaps.png,cell_score_summary.csv and entropy_cell_summary.csv,H_norm_sigmoid_s_v1 anthropic/claude-sonnet-4.5 T3 anger burden=0.654771; score deepseek/deepseek-v3.2 T3 sadness burden=0.039432,False
figure2a_entropy_heatmap,artifacts/scis2026/main_figures_v1/figure2a_entropy_heatmap.png,cell_score_summary.csv and entropy_cell_summary.csv,"Representative high-interaction entropy case. Normalized fuzzy entropy \(H^*\) for Claude Sonnet 4.5 on Text 3, anger. Axes show four personas and four temperatures; cell values are repeat means. This example has B=0.655 and should not be read as the panel average.",True
figure2b_score_heatmap,artifacts/scis2026/main_figures_v1/figure2b_score_heatmap.png,cell_score_summary.csv and entropy_cell_summary.csv,"Representative low-interaction score case. Mean score for DeepSeek V3.2 on Text 3, sadness. Axes show four personas and four temperatures; cell values are repeat means. This example has B=0.039.",True
figure3_model_metric_interaction_heatmap,artifacts/scis2026/main_figures_v1/figure3_model_metric_interaction_heatmap.png,table3_model_metric_summary.csv,"Mean persona-temperature interaction burden by model, averaged over texts and emotions. Score and normalized fuzzy entropy \(H^*\) are summarized under the same crossed cell structure.",True
